[
  {
    "id": "ram-kripa-sundar",
    "deityId": null,
    "titleGu": "રામ કૃપા સુંદર",
    "titleHi": "राम कृपा सुंदर",
    "titleEn": "Ram Kripa Sundar",
    "audioUrl": "https://github.com/dharmik-tech9/sanatan-content/releases/download/ringtones-v1/ram-kripa-sundar.mp3",
    "durationMs": 340000,
    "fileSizeBytes": 8192443,
    "featured": true,
    "isActive": true,
    "sortOrder": 0,
    "tags": ["aarti"]
  },
  {
    "id": "jai-rudra-bhagwant",
    "deityId": null,
    "titleGu": "જય રુદ્ર ભગવંત",
    "titleHi": "जय रुद्र भगवंत",
    "titleEn": "Jai Rudra Bhagwant",
    "audioUrl": "https://github.com/dharmik-tech9/sanatan-content/releases/download/ringtones-v1/jai-rudra-bhagwant.mp3",
    "durationMs": 315000,
    "fileSizeBytes": 7469104,
    "featured": true,
    "isActive": true,
    "sortOrder": 1,
    "tags": ["aarti"]
  },
  {
    "id": "bhagavad-gita-narration",
    "deityId": null,
    "titleGu": "ભગવદ ગીતા કથન",
    "titleHi": "भगवद गीता कथन",
    "titleEn": "Bhagavad Gita Narration",
    "audioUrl": "https://github.com/dharmik-tech9/sanatan-content/releases/download/ringtones-v1/bhagavad-gita-narration.mp3",
    "durationMs": 36000,
    "fileSizeBytes": 592177,
    "featured": false,
    "isActive": true,
    "sortOrder": 2,
    "tags": ["gita"]
  },
  {
    "id": "namo-vishnu",
    "deityId": null,
    "titleGu": "નમો વિષ્ણુ ભગવાન ખરારી",
    "titleHi": "नमो विष्णु भगवान खरारी",
    "titleEn": "Namo Vishnu Bhagwan Kharari",
    "audioUrl": "https://github.com/dharmik-tech9/sanatan-content/releases/download/ringtones-v1/namo-vishnu.mp3",
    "durationMs": 344000,
    "fileSizeBytes": 8253439,
    "featured": false,
    "isActive": true,
    "sortOrder": 3,
    "tags": ["chalisa"]
  },
  {
    "id": "jai-guru-nanak",
    "deityId": null,
    "titleGu": "જય હો ગુરુ નાનક",
    "titleHi": "जय हो गुरु नानक",
    "titleEn": "Jai Ho Guru Nanak",
    "audioUrl": "https://github.com/dharmik-tech9/sanatan-content/releases/download/ringtones-v1/jai-guru-nanak.mp3",
    "durationMs": 418000,
    "fileSizeBytes": 10012042,
    "featured": false,
    "isActive": true,
    "sortOrder": 4,
    "tags": ["bhajan"]
  },
  {
    "id": "pitambar",
    "deityId": null,
    "titleGu": "પીતામ્બર નમો કલ્યાણી",
    "titleHi": "पीताम्बर नमो कल्यानी",
    "titleEn": "Pitambar Namo Kalyani",
    "audioUrl": "https://github.com/dharmik-tech9/sanatan-content/releases/download/ringtones-v1/pitambar.mp3",
    "durationMs": 480000,
    "fileSizeBytes": 11961572,
    "featured": false,
    "isActive": true,
    "sortOrder": 5,
    "tags": ["bhajan"]
  }
]
